{
  "content_type_counts": {
    "aside_text": 73,
    "chart": 56,
    "code": 3,
    "equation": 2774,
    "footer": 13,
    "header": 185,
    "image": 161,
    "list": 329,
    "page_footnote": 206,
    "page_number": 1029,
    "ref_text": 2,
    "table": 65,
    "text": 6996
  },
  "document_count": 42,
  "documents": [
    {
      "artifact_bytes": 11987082,
      "artifact_file_count": 53,
      "content_item_count": 116,
      "content_list_relpath": "build/document_ocr/mineru_corpus/094101_1_accepted_manuscript/hybrid_auto/094101_1_accepted_manuscript_content_list.json",
      "content_list_sha256": "a5a8aaeb27494666f9500fbf8bd15a1effc9b854cf80a6c751205264807e6fe2",
      "content_type_counts": {
        "aside_text": 42,
        "chart": 3,
        "footer": 5,
        "header": 11,
        "image": 12,
        "list": 3,
        "page_footnote": 1,
        "page_number": 6,
        "text": 33
      },
      "markdown_bytes": 31705,
      "markdown_nonspace_characters": 26541,
      "markdown_relpath": "build/document_ocr/mineru_corpus/094101_1_accepted_manuscript/hybrid_auto/094101_1_accepted_manuscript.md",
      "markdown_sha256": "692369f8d742c09800f8c5e2cb6ef35cceb900358770ae42ad75d6dba726d556",
      "page_count": 11,
      "source_relpath": "source_materials/pdfs/094101_1_accepted_manuscript.pdf",
      "source_sha256": "8ec8b02db96d399d3d510973b9d523560cda0d1564030f5300f38229ec54fc5e"
    },
    {
      "artifact_bytes": 3310880,
      "artifact_file_count": 24,
      "content_item_count": 84,
      "content_list_relpath": "build/document_ocr/mineru_corpus/1111.4064v2/hybrid_auto/1111.4064v2_content_list.json",
      "content_list_sha256": "7b747900df635630cf2a66a9905f26419374f8b337aba6b17825202abb6dbed4",
      "content_type_counts": {
        "equation": 10,
        "image": 1,
        "list": 3,
        "page_number": 18,
        "table": 2,
        "text": 50
      },
      "markdown_bytes": 31657,
      "markdown_nonspace_characters": 24775,
      "markdown_relpath": "build/document_ocr/mineru_corpus/1111.4064v2/hybrid_auto/1111.4064v2.md",
      "markdown_sha256": "ccd8d2586b1694d27177e5354e1a9d4d05d2510e681592e39f818814faece657",
      "page_count": 18,
      "source_relpath": "source_materials/pdfs/1111.4064v2.pdf",
      "source_sha256": "96257d6e694f74eb65ba99e87a40e7003745e85abccd2356c918c56ed5eede05"
    },
    {
      "artifact_bytes": 420871,
      "artifact_file_count": 9,
      "content_item_count": 28,
      "content_list_relpath": "build/document_ocr/mineru_corpus/978-3-319-48210-1_10/hybrid_auto/978-3-319-48210-1_10_content_list.json",
      "content_list_sha256": "ffe862d4216ec422a593b51a357b2f1bb6c6de7e1653b6d29721e7b70a7b2a1b",
      "content_type_counts": {
        "equation": 1,
        "header": 4,
        "page_number": 2,
        "table": 1,
        "text": 20
      },
      "markdown_bytes": 5731,
      "markdown_nonspace_characters": 4911,
      "markdown_relpath": "build/document_ocr/mineru_corpus/978-3-319-48210-1_10/hybrid_auto/978-3-319-48210-1_10.md",
      "markdown_sha256": "a59480c1a39c8302db67d836fa727719874781614f7e7054e468bb4f2c0bf443",
      "page_count": 2,
      "source_relpath": "source_materials/pdfs/978-3-319-48210-1_10.pdf",
      "source_sha256": "3f4cb6db41b894b29bd9eb658d2d629c814e6553316847cfaa75398c1ce8faeb"
    },
    {
      "artifact_bytes": 7064599,
      "artifact_file_count": 30,
      "content_item_count": 54,
      "content_list_relpath": "build/document_ocr/mineru_corpus/Comment_on_the_Pais_Superforce_Theory/hybrid_auto/Comment_on_the_Pais_Superforce_Theory_content_list.json",
      "content_list_sha256": "64512aec7d69925f38895b9bf55b50acb51d7089a2d042dd116935ae6ead5556",
      "content_type_counts": {
        "chart": 1,
        "equation": 14,
        "image": 6,
        "list": 3,
        "text": 30
      },
      "markdown_bytes": 5785,
      "markdown_nonspace_characters": 4640,
      "markdown_relpath": "build/document_ocr/mineru_corpus/Comment_on_the_Pais_Superforce_Theory/hybrid_auto/Comment_on_the_Pais_Superforce_Theory.md",
      "markdown_sha256": "42f14c2314dea6fae6df9556645be2f246d6d49e513df72d66292955ce45391e",
      "page_count": 13,
      "source_relpath": "source_materials/pdfs/Comment_on_the_Pais_Superforce_Theory.pdf",
      "source_sha256": "ca32b85da9dc732509ea4560184c160e2e503f56bea861c7a05542040f9e9b75"
    },
    {
      "artifact_bytes": 2330369,
      "artifact_file_count": 25,
      "content_item_count": 86,
      "content_list_relpath": "build/document_ocr/mineru_corpus/Phys-140A-lecture-14v3/hybrid_auto/Phys-140A-lecture-14v3_content_list.json",
      "content_list_sha256": "146036f61befaf01d77616e6895e8ade59b789b35b8688cbe3cfda342c1bf199",
      "content_type_counts": {
        "equation": 13,
        "image": 3,
        "list": 4,
        "table": 2,
        "text": 64
      },
      "markdown_bytes": 19254,
      "markdown_nonspace_characters": 15532,
      "markdown_relpath": "build/document_ocr/mineru_corpus/Phys-140A-lecture-14v3/hybrid_auto/Phys-140A-lecture-14v3.md",
      "markdown_sha256": "2f7668d06014e6c0776ae131224e46528cb243148af61ffe0f4134cbccc4b5a4",
      "page_count": 8,
      "source_relpath": "source_materials/pdfs/Phys-140A-lecture-14v3.pdf",
      "source_sha256": "3f789aedd14872d1a56c24ce62f293dac7dc6e3a6bcaa9f60b18afaf5684c859"
    },
    {
      "artifact_bytes": 1006752,
      "artifact_file_count": 9,
      "content_item_count": 41,
      "content_list_relpath": "build/document_ocr/mineru_corpus/SUPERFORCE---S.C.Pais---2023/hybrid_auto/SUPERFORCE---S.C.Pais---2023_content_list.json",
      "content_list_sha256": "c092e67881fd224d371c07da084a5d147a4fce4c2e14c3d5ad7a5ae9cd85c829",
      "content_type_counts": {
        "equation": 2,
        "list": 1,
        "page_footnote": 1,
        "page_number": 3,
        "text": 34
      },
      "markdown_bytes": 11143,
      "markdown_nonspace_characters": 8814,
      "markdown_relpath": "build/document_ocr/mineru_corpus/SUPERFORCE---S.C.Pais---2023/hybrid_auto/SUPERFORCE---S.C.Pais---2023.md",
      "markdown_sha256": "11e12860a49188a2321caadc69f1beaf4c2dae53a2f5e342712bdeba9cd9ca1d",
      "page_count": 3,
      "source_relpath": "source_materials/pdfs/SUPERFORCE---S.C.Pais---2023.pdf",
      "source_sha256": "8ea4fecbd504b2dfa73941f856befe5bee23b1ebffa8a6a8bbd19e185a675176"
    },
    {
      "artifact_bytes": 4057330,
      "artifact_file_count": 49,
      "content_item_count": 177,
      "content_list_relpath": "build/document_ocr/mineru_corpus/Superframework-Foam-Octonions/hybrid_auto/Superframework-Foam-Octonions_content_list.json",
      "content_list_sha256": "fca17d036262bc25ce79d9e022d6b5f808b7e6477eb4a3a7111deb315734864c",
      "content_type_counts": {
        "chart": 3,
        "code": 1,
        "equation": 29,
        "image": 8,
        "list": 18,
        "page_number": 15,
        "text": 103
      },
      "markdown_bytes": 16618,
      "markdown_nonspace_characters": 13792,
      "markdown_relpath": "build/document_ocr/mineru_corpus/Superframework-Foam-Octonions/hybrid_auto/Superframework-Foam-Octonions.md",
      "markdown_sha256": "ad3d1b82b05f2c48e66c72e0e16eeaef64948191b41f3546063f7747373ccf57",
      "page_count": 15,
      "source_relpath": "source_materials/pdfs/Superframework-Foam-Octonions.pdf",
      "source_sha256": "571c445f4d8ac3a85efc955806783efc8f2bda7d94547056823e4e7a47e0fea8"
    },
    {
      "artifact_bytes": 2528769,
      "artifact_file_count": 44,
      "content_item_count": 217,
      "content_list_relpath": "build/document_ocr/mineru_corpus/Superframework_Expansion/hybrid_auto/Superframework_Expansion_content_list.json",
      "content_list_sha256": "2a64b669fdd560fc715b5ff085bbab8bf89b2d92d82ca0b53b5864f05fc65b4e",
      "content_type_counts": {
        "equation": 35,
        "list": 28,
        "page_number": 17,
        "text": 137
      },
      "markdown_bytes": 28750,
      "markdown_nonspace_characters": 24423,
      "markdown_relpath": "build/document_ocr/mineru_corpus/Superframework_Expansion/hybrid_auto/Superframework_Expansion.md",
      "markdown_sha256": "c1d0791057ec21a3bd580e37502a12e4b03e81a4e8a42114079157bbbbc4af2d",
      "page_count": 17,
      "source_relpath": "source_materials/pdfs/Superframework_Expansion.pdf",
      "source_sha256": "8732128532cccd5f22b1f333735f444aa2268b72097020256f072a08a2024297"
    },
    {
      "artifact_bytes": 3444801,
      "artifact_file_count": 76,
      "content_item_count": 370,
      "content_list_relpath": "build/document_ocr/mineru_corpus/Tourmaline/hybrid_auto/Tourmaline_content_list.json",
      "content_list_sha256": "d343239279172c9e691505d9ef13c366c7fefa0113d4bb34f41d6b8a3e7f0ad0",
      "content_type_counts": {
        "equation": 63,
        "list": 29,
        "page_number": 23,
        "text": 255
      },
      "markdown_bytes": 37908,
      "markdown_nonspace_characters": 31221,
      "markdown_relpath": "build/document_ocr/mineru_corpus/Tourmaline/hybrid_auto/Tourmaline.md",
      "markdown_sha256": "4d5ada313167250065bb569e64e6884e5ac45ab1e98a0f9d10a17beb9cc731be",
      "page_count": 23,
      "source_relpath": "source_materials/pdfs/Tourmaline.pdf",
      "source_sha256": "11dfbf3969c24812b66f30a1dcf33c4685f4125bb82dc4b5e25ba05498870fdf"
    },
    {
      "artifact_bytes": 590637,
      "artifact_file_count": 20,
      "content_item_count": 50,
      "content_list_relpath": "build/document_ocr/mineru_corpus/Tourmaline_Addendum/hybrid_auto/Tourmaline_Addendum_content_list.json",
      "content_list_sha256": "94b8cd44e0135638f5f7f02bd2e282e712ac68a5c1ce5846ec3f5514a61fa864",
      "content_type_counts": {
        "equation": 13,
        "list": 1,
        "page_number": 3,
        "text": 33
      },
      "markdown_bytes": 3924,
      "markdown_nonspace_characters": 3315,
      "markdown_relpath": "build/document_ocr/mineru_corpus/Tourmaline_Addendum/hybrid_auto/Tourmaline_Addendum.md",